{
  "pattern_id": "publication_confirmation",
  "pattern_name": "Publication Confirmation",
  "pattern_category": "control_and_safety",
  "objective": "Confirm publication succeeded and capture evidence.",
  "problem_context": "Quotation PDF email and social publication workflows.",
  "capability_ids": [
    "publication",
    "email_marketing"
  ],
  "related_skill_ids": [
    "ms.skill.n8n_workflow_architecture"
  ],
  "input_contract": {
    "type": "object",
    "required": [
      "tenant_context",
      "correlation_id"
    ]
  },
  "output_contract": {
    "type": "object",
    "required": [
      "status",
      "evidence_refs"
    ]
  },
  "steps": [
    {
      "step_id": "s1",
      "step_name": "Approve draft",
      "step_type": "approval",
      "security_class": "publication"
    },
    {
      "step_id": "s2",
      "step_name": "Publish",
      "step_type": "publish",
      "security_class": "publication"
    },
    {
      "step_id": "s3",
      "step_name": "Capture confirmation",
      "step_type": "evidence",
      "security_class": "write_internal"
    }
  ],
  "edges": [
    {
      "edge_id": "e1",
      "from_step_id": "s1",
      "to_step_id": "s2",
      "condition": "approved"
    },
    {
      "edge_id": "e2",
      "from_step_id": "s2",
      "to_step_id": "s3"
    }
  ],
  "required_connectors": [],
  "required_tools": [],
  "approval_requirements": {
    "human_approval_required": true,
    "approval_gates": [
      "before_publication"
    ],
    "auto_approval_allowed": false,
    "spend_approval_required": false,
    "publication_approval_required": true
  },
  "evidence_requirements": {
    "required": true,
    "evidence_classes": [
      "approval_record",
      "execution_log"
    ],
    "minimum_evidence_count": 2
  },
  "idempotency_requirements": {
    "required": true,
    "policy": "dedupe_by_event_id",
    "unknown_outcome_auto_retry": false,
    "duplicate_event_prevention": true
  },
  "retry_policy": "none",
  "timeout_policy": "core_default_120s",
  "rate_limit_policy": "provider_default",
  "error_paths": [
    "human_review",
    "dead_letter"
  ],
  "rollback_or_recovery": "manual_review",
  "security_class": "publication",
  "tenant_scope": "tenant_scoped",
  "personal_data_class": "unknown",
  "publication_sensitive": true,
  "billing_sensitive": false,
  "destructive": false,
  "implementation_variants": [
    {
      "provider": "Gmail",
      "component": "publication_target",
      "documented_version": "source_catalog_0.1.0",
      "documented_at": "2026-07-23",
      "verification_status": "source_documented",
      "requires_reverification": true,
      "notes": "Observed in frozen catalog metadata only; not executed in core build.",
      "provenance": {
        "source_type": "pattern_extraction_core",
        "archive_id": "arc-bots-knowledge-rar",
        "source_id": "variant-Gmail",
        "program_phase": "KB-WPL-01.3B"
      }
    }
  ],
  "source_workflow_ids": [
    "wf-497aa9eee8a759da",
    "wf-9f3a78220a7bfbe3"
  ],
  "source_practice_ids": [
    "post_publish_evidence_capture"
  ],
  "known_limitations": [
    "Channel-specific confirmation payloads in variants only."
  ],
  "quality_gates": [
    {
      "gate_id": "publication_confirmation-schema_valid",
      "title": "Pattern validates against workflow-pattern schema",
      "description": "Pattern validates against workflow-pattern schema",
      "severity": "blocking",
      "verification_status": "source_documented",
      "provenance": {
        "source_type": "pattern_extraction_core",
        "archive_id": "arc-bots-knowledge-rar",
        "source_id": "gates-publication_confirmation",
        "program_phase": "KB-WPL-01.3B"
      }
    },
    {
      "gate_id": "publication_confirmation-source_support_valid",
      "title": "Source support gate satisfied",
      "description": "Source support gate satisfied",
      "severity": "blocking",
      "verification_status": "source_documented",
      "provenance": {
        "source_type": "pattern_extraction_core",
        "archive_id": "arc-bots-knowledge-rar",
        "source_id": "gates-publication_confirmation",
        "program_phase": "KB-WPL-01.3B"
      }
    },
    {
      "gate_id": "publication_confirmation-provider_neutral",
      "title": "Main flow uses functional abstractions only",
      "description": "Main flow uses functional abstractions only",
      "severity": "blocking",
      "verification_status": "source_documented",
      "provenance": {
        "source_type": "pattern_extraction_core",
        "archive_id": "arc-bots-knowledge-rar",
        "source_id": "gates-publication_confirmation",
        "program_phase": "KB-WPL-01.3B"
      }
    },
    {
      "gate_id": "publication_confirmation-no_credentials",
      "title": "No credential identifiers in pattern body",
      "description": "No credential identifiers in pattern body",
      "severity": "blocking",
      "verification_status": "source_documented",
      "provenance": {
        "source_type": "pattern_extraction_core",
        "archive_id": "arc-bots-knowledge-rar",
        "source_id": "gates-publication_confirmation",
        "program_phase": "KB-WPL-01.3B"
      }
    },
    {
      "gate_id": "publication_confirmation-approval_boundary_valid",
      "title": "Approval boundaries match sensitivity",
      "description": "Approval boundaries match sensitivity",
      "severity": "blocking",
      "verification_status": "source_documented",
      "provenance": {
        "source_type": "pattern_extraction_core",
        "archive_id": "arc-bots-knowledge-rar",
        "source_id": "gates-publication_confirmation",
        "program_phase": "KB-WPL-01.3B"
      }
    },
    {
      "gate_id": "publication_confirmation-evidence_boundary_valid",
      "title": "Evidence requirements documented",
      "description": "Evidence requirements documented",
      "severity": "blocking",
      "verification_status": "source_documented",
      "provenance": {
        "source_type": "pattern_extraction_core",
        "archive_id": "arc-bots-knowledge-rar",
        "source_id": "gates-publication_confirmation",
        "program_phase": "KB-WPL-01.3B"
      }
    },
    {
      "gate_id": "publication_confirmation-tenant_boundary_valid",
      "title": "Tenant scope preserved",
      "description": "Tenant scope preserved",
      "severity": "blocking",
      "verification_status": "source_documented",
      "provenance": {
        "source_type": "pattern_extraction_core",
        "archive_id": "arc-bots-knowledge-rar",
        "source_id": "gates-publication_confirmation",
        "program_phase": "KB-WPL-01.3B"
      }
    },
    {
      "gate_id": "publication_confirmation-idempotency_valid",
      "title": "Idempotency policy matches retry behavior",
      "description": "Idempotency policy matches retry behavior",
      "severity": "blocking",
      "verification_status": "source_documented",
      "provenance": {
        "source_type": "pattern_extraction_core",
        "archive_id": "arc-bots-knowledge-rar",
        "source_id": "gates-publication_confirmation",
        "program_phase": "KB-WPL-01.3B"
      }
    },
    {
      "gate_id": "publication_confirmation-error_path_present",
      "title": "Terminal error path documented",
      "description": "Terminal error path documented",
      "severity": "blocking",
      "verification_status": "source_documented",
      "provenance": {
        "source_type": "pattern_extraction_core",
        "archive_id": "arc-bots-knowledge-rar",
        "source_id": "gates-publication_confirmation",
        "program_phase": "KB-WPL-01.3B"
      }
    },
    {
      "gate_id": "publication_confirmation-limitations_documented",
      "title": "Known limitations listed",
      "description": "Known limitations listed",
      "severity": "blocking",
      "verification_status": "source_documented",
      "provenance": {
        "source_type": "pattern_extraction_core",
        "archive_id": "arc-bots-knowledge-rar",
        "source_id": "gates-publication_confirmation",
        "program_phase": "KB-WPL-01.3B"
      }
    },
    {
      "gate_id": "publication_confirmation-manual_review_complete",
      "title": "Manual core audit complete",
      "description": "Manual core audit complete",
      "severity": "blocking",
      "verification_status": "source_documented",
      "provenance": {
        "source_type": "pattern_extraction_core",
        "archive_id": "arc-bots-knowledge-rar",
        "source_id": "gates-publication_confirmation",
        "program_phase": "KB-WPL-01.3B"
      }
    }
  ],
  "maturity": "reviewed",
  "provenance": {
    "source_type": "pattern_extraction_core",
    "archive_id": "arc-bots-knowledge-rar",
    "source_id": "publication_confirmation",
    "program_phase": "KB-WPL-01.3B"
  }
}
