{
  "pattern_id": "draft_to_human_approval",
  "pattern_name": "Draft to Human Approval",
  "pattern_category": "control_and_safety",
  "objective": "Hold content in draft state until human approve/reject decision.",
  "problem_context": "Moderation and legal review workflows before any external action.",
  "capability_ids": [
    "human_approval",
    "publication"
  ],
  "related_skill_ids": [
    "ms.skill.n8n_workflow_architecture"
  ],
  "input_contract": {
    "type": "object",
    "required": [
      "tenant_context",
      "correlation_id"
    ]
  },
  "output_contract": {
    "type": "object",
    "required": [
      "status",
      "evidence_refs"
    ]
  },
  "steps": [
    {
      "step_id": "s1",
      "step_name": "Create draft artifact",
      "step_type": "transform",
      "security_class": "read_only"
    },
    {
      "step_id": "s2",
      "step_name": "Present draft on approval_interface",
      "step_type": "approval",
      "approval_gate": "before_external_action",
      "security_class": "elevated_review"
    },
    {
      "step_id": "s3",
      "step_name": "Resume only after authoritative decision",
      "step_type": "branch",
      "security_class": "read_only"
    },
    {
      "step_id": "s4",
      "step_name": "Persist decision lineage",
      "step_type": "evidence",
      "security_class": "write_internal"
    }
  ],
  "edges": [
    {
      "edge_id": "e1",
      "from_step_id": "s1",
      "to_step_id": "s2"
    },
    {
      "edge_id": "e2",
      "from_step_id": "s2",
      "to_step_id": "s3"
    },
    {
      "edge_id": "e3",
      "from_step_id": "s3",
      "to_step_id": "s4",
      "condition": "decision_recorded"
    },
    {
      "edge_id": "e4",
      "from_step_id": "s3",
      "to_step_id": "s1",
      "condition": "rejected",
      "on_failure": "human_review"
    }
  ],
  "required_connectors": [],
  "required_tools": [],
  "approval_requirements": {
    "human_approval_required": true,
    "approval_gates": [
      "before_publication",
      "before_external_action"
    ],
    "auto_approval_allowed": false,
    "spend_approval_required": false,
    "publication_approval_required": true
  },
  "evidence_requirements": {
    "required": true,
    "evidence_classes": [
      "approval_record",
      "execution_log"
    ],
    "minimum_evidence_count": 2
  },
  "idempotency_requirements": {
    "required": true,
    "policy": "dedupe_by_event_id",
    "unknown_outcome_auto_retry": false,
    "duplicate_event_prevention": true
  },
  "retry_policy": "none",
  "timeout_policy": "pilot_default_120s",
  "rate_limit_policy": "provider_default",
  "error_paths": [
    "human_review"
  ],
  "rollback_or_recovery": "manual_review",
  "security_class": "elevated_review",
  "tenant_scope": "tenant_scoped",
  "personal_data_class": "unknown",
  "publication_sensitive": true,
  "billing_sensitive": false,
  "destructive": false,
  "implementation_variants": [
    {
      "provider": "Slack",
      "component": "approval_interface",
      "documented_version": "source_catalog_0.1.0",
      "documented_at": "2026-07-23",
      "verification_status": "source_documented",
      "requires_reverification": true,
      "notes": "Observed in frozen catalog metadata only; not executed in pilot.",
      "provenance": {
        "source_type": "pattern_extraction_pilot",
        "archive_id": "arc-bots-knowledge-rar",
        "source_id": "variant-Slack",
        "program_phase": "KB-WPL-01.3A.1"
      }
    }
  ],
  "source_workflow_ids": [
    "wf-febea81827b8ad6b",
    "wf-de3f478cf93ab7e0"
  ],
  "source_practice_ids": [
    "draft_review_resume",
    "human_approval_before_write_or_publication"
  ],
  "known_limitations": [
    "Decision lineage format not standardized across approval_interface variants.",
    "Pilot does not include auto-resume after timeout."
  ],
  "quality_gates": [
    {
      "gate_id": "draft_to_human_approval-schema_valid",
      "title": "Pattern validates against workflow-pattern schema",
      "description": "Pattern validates against workflow-pattern schema",
      "severity": "blocking",
      "verification_status": "source_documented",
      "provenance": {
        "source_type": "pattern_extraction_pilot",
        "archive_id": "arc-bots-knowledge-rar",
        "source_id": "gates-draft_to_human_approval",
        "program_phase": "KB-WPL-01.3A.1"
      }
    },
    {
      "gate_id": "draft_to_human_approval-source_support_valid",
      "title": "Source support gate satisfied",
      "description": "Source support gate satisfied",
      "severity": "blocking",
      "verification_status": "source_documented",
      "provenance": {
        "source_type": "pattern_extraction_pilot",
        "archive_id": "arc-bots-knowledge-rar",
        "source_id": "gates-draft_to_human_approval",
        "program_phase": "KB-WPL-01.3A.1"
      }
    },
    {
      "gate_id": "draft_to_human_approval-provider_neutral",
      "title": "Main flow uses functional abstractions only",
      "description": "Main flow uses functional abstractions only",
      "severity": "blocking",
      "verification_status": "source_documented",
      "provenance": {
        "source_type": "pattern_extraction_pilot",
        "archive_id": "arc-bots-knowledge-rar",
        "source_id": "gates-draft_to_human_approval",
        "program_phase": "KB-WPL-01.3A.1"
      }
    },
    {
      "gate_id": "draft_to_human_approval-no_credentials",
      "title": "No credential identifiers in pattern body",
      "description": "No credential identifiers in pattern body",
      "severity": "blocking",
      "verification_status": "source_documented",
      "provenance": {
        "source_type": "pattern_extraction_pilot",
        "archive_id": "arc-bots-knowledge-rar",
        "source_id": "gates-draft_to_human_approval",
        "program_phase": "KB-WPL-01.3A.1"
      }
    },
    {
      "gate_id": "draft_to_human_approval-approval_boundary_valid",
      "title": "Approval boundaries match sensitivity",
      "description": "Approval boundaries match sensitivity",
      "severity": "blocking",
      "verification_status": "source_documented",
      "provenance": {
        "source_type": "pattern_extraction_pilot",
        "archive_id": "arc-bots-knowledge-rar",
        "source_id": "gates-draft_to_human_approval",
        "program_phase": "KB-WPL-01.3A.1"
      }
    },
    {
      "gate_id": "draft_to_human_approval-evidence_boundary_valid",
      "title": "Evidence requirements documented",
      "description": "Evidence requirements documented",
      "severity": "blocking",
      "verification_status": "source_documented",
      "provenance": {
        "source_type": "pattern_extraction_pilot",
        "archive_id": "arc-bots-knowledge-rar",
        "source_id": "gates-draft_to_human_approval",
        "program_phase": "KB-WPL-01.3A.1"
      }
    },
    {
      "gate_id": "draft_to_human_approval-tenant_boundary_valid",
      "title": "Tenant scope preserved",
      "description": "Tenant scope preserved",
      "severity": "blocking",
      "verification_status": "source_documented",
      "provenance": {
        "source_type": "pattern_extraction_pilot",
        "archive_id": "arc-bots-knowledge-rar",
        "source_id": "gates-draft_to_human_approval",
        "program_phase": "KB-WPL-01.3A.1"
      }
    },
    {
      "gate_id": "draft_to_human_approval-idempotency_valid",
      "title": "Idempotency policy matches retry behavior",
      "description": "Idempotency policy matches retry behavior",
      "severity": "blocking",
      "verification_status": "source_documented",
      "provenance": {
        "source_type": "pattern_extraction_pilot",
        "archive_id": "arc-bots-knowledge-rar",
        "source_id": "gates-draft_to_human_approval",
        "program_phase": "KB-WPL-01.3A.1"
      }
    },
    {
      "gate_id": "draft_to_human_approval-error_path_present",
      "title": "Terminal error path documented",
      "description": "Terminal error path documented",
      "severity": "blocking",
      "verification_status": "source_documented",
      "provenance": {
        "source_type": "pattern_extraction_pilot",
        "archive_id": "arc-bots-knowledge-rar",
        "source_id": "gates-draft_to_human_approval",
        "program_phase": "KB-WPL-01.3A.1"
      }
    },
    {
      "gate_id": "draft_to_human_approval-limitations_documented",
      "title": "Known limitations listed",
      "description": "Known limitations listed",
      "severity": "blocking",
      "verification_status": "source_documented",
      "provenance": {
        "source_type": "pattern_extraction_pilot",
        "archive_id": "arc-bots-knowledge-rar",
        "source_id": "gates-draft_to_human_approval",
        "program_phase": "KB-WPL-01.3A.1"
      }
    },
    {
      "gate_id": "draft_to_human_approval-manual_review_complete",
      "title": "Manual pilot audit complete",
      "description": "Manual pilot audit complete",
      "severity": "blocking",
      "verification_status": "source_documented",
      "provenance": {
        "source_type": "pattern_extraction_pilot",
        "archive_id": "arc-bots-knowledge-rar",
        "source_id": "gates-draft_to_human_approval",
        "program_phase": "KB-WPL-01.3A.1"
      }
    }
  ],
  "maturity": "reviewed",
  "provenance": {
    "source_type": "pattern_extraction_pilot",
    "archive_id": "arc-bots-knowledge-rar",
    "source_id": "draft_to_human_approval",
    "program_phase": "KB-WPL-01.3A.1"
  }
}
