{
  "pattern_id": "specialist_subworkflow",
  "pattern_name": "Specialist Subworkflow",
  "pattern_category": "ai_integration",
  "objective": "Isolate specialist logic in bounded sub-workflow scope.",
  "problem_context": "Multi-tool marketing agents with document integrations.",
  "capability_ids": [
    "agent_orchestration",
    "publication"
  ],
  "related_skill_ids": [
    "ms.skill.n8n_workflow_architecture"
  ],
  "input_contract": {
    "type": "object",
    "required": [
      "tenant_context",
      "correlation_id",
      "specialist_scope"
    ]
  },
  "output_contract": {
    "type": "object",
    "required": [
      "status",
      "evidence_refs"
    ]
  },
  "steps": [
    {
      "step_id": "s1",
      "step_name": "Declare scope",
      "step_type": "transform",
      "security_class": "read_only"
    },
    {
      "step_id": "s2",
      "step_name": "Invoke specialist",
      "step_type": "delegate",
      "security_class": "write_internal"
    },
    {
      "step_id": "s3",
      "step_name": "Validate scope",
      "step_type": "validate",
      "security_class": "read_only"
    }
  ],
  "edges": [
    {
      "edge_id": "e1",
      "from_step_id": "s1",
      "to_step_id": "s2"
    },
    {
      "edge_id": "e2",
      "from_step_id": "s2",
      "to_step_id": "s3"
    }
  ],
  "required_connectors": [],
  "required_tools": [],
  "approval_requirements": {
    "human_approval_required": false,
    "approval_gates": [],
    "auto_approval_allowed": false,
    "spend_approval_required": false,
    "publication_approval_required": false
  },
  "evidence_requirements": {
    "required": true,
    "evidence_classes": [
      "execution_log"
    ]
  },
  "idempotency_requirements": {
    "required": true,
    "policy": "dedupe_by_event_id",
    "unknown_outcome_auto_retry": false,
    "duplicate_event_prevention": true
  },
  "retry_policy": "none",
  "timeout_policy": "core_default_120s",
  "rate_limit_policy": "provider_default",
  "error_paths": [
    "human_review"
  ],
  "rollback_or_recovery": "manual_review",
  "security_class": "write_internal",
  "tenant_scope": "tenant_scoped",
  "personal_data_class": "unknown",
  "publication_sensitive": false,
  "billing_sensitive": false,
  "destructive": false,
  "implementation_variants": [
    {
      "provider": "LangChain",
      "component": "agent_orchestration",
      "documented_version": "source_catalog_0.1.0",
      "documented_at": "2026-07-23",
      "verification_status": "source_documented",
      "requires_reverification": true,
      "notes": "Observed in frozen catalog metadata only; not executed in core build.",
      "provenance": {
        "source_type": "pattern_extraction_core",
        "archive_id": "arc-bots-knowledge-rar",
        "source_id": "variant-LangChain",
        "program_phase": "KB-WPL-01.3B"
      }
    }
  ],
  "source_workflow_ids": [
    "wf-b2aea5e382059f4b",
    "wf-7c284d78aad2003d"
  ],
  "source_practice_ids": [
    "specialist_scope_isolation"
  ],
  "known_limitations": [
    "Scope declaration format not yet platform-adapted."
  ],
  "quality_gates": [
    {
      "gate_id": "specialist_subworkflow-schema_valid",
      "title": "Pattern validates against workflow-pattern schema",
      "description": "Pattern validates against workflow-pattern schema",
      "severity": "blocking",
      "verification_status": "source_documented",
      "provenance": {
        "source_type": "pattern_extraction_core",
        "archive_id": "arc-bots-knowledge-rar",
        "source_id": "gates-specialist_subworkflow",
        "program_phase": "KB-WPL-01.3B"
      }
    },
    {
      "gate_id": "specialist_subworkflow-source_support_valid",
      "title": "Source support gate satisfied",
      "description": "Source support gate satisfied",
      "severity": "blocking",
      "verification_status": "source_documented",
      "provenance": {
        "source_type": "pattern_extraction_core",
        "archive_id": "arc-bots-knowledge-rar",
        "source_id": "gates-specialist_subworkflow",
        "program_phase": "KB-WPL-01.3B"
      }
    },
    {
      "gate_id": "specialist_subworkflow-provider_neutral",
      "title": "Main flow uses functional abstractions only",
      "description": "Main flow uses functional abstractions only",
      "severity": "blocking",
      "verification_status": "source_documented",
      "provenance": {
        "source_type": "pattern_extraction_core",
        "archive_id": "arc-bots-knowledge-rar",
        "source_id": "gates-specialist_subworkflow",
        "program_phase": "KB-WPL-01.3B"
      }
    },
    {
      "gate_id": "specialist_subworkflow-no_credentials",
      "title": "No credential identifiers in pattern body",
      "description": "No credential identifiers in pattern body",
      "severity": "blocking",
      "verification_status": "source_documented",
      "provenance": {
        "source_type": "pattern_extraction_core",
        "archive_id": "arc-bots-knowledge-rar",
        "source_id": "gates-specialist_subworkflow",
        "program_phase": "KB-WPL-01.3B"
      }
    },
    {
      "gate_id": "specialist_subworkflow-approval_boundary_valid",
      "title": "Approval boundaries match sensitivity",
      "description": "Approval boundaries match sensitivity",
      "severity": "blocking",
      "verification_status": "source_documented",
      "provenance": {
        "source_type": "pattern_extraction_core",
        "archive_id": "arc-bots-knowledge-rar",
        "source_id": "gates-specialist_subworkflow",
        "program_phase": "KB-WPL-01.3B"
      }
    },
    {
      "gate_id": "specialist_subworkflow-evidence_boundary_valid",
      "title": "Evidence requirements documented",
      "description": "Evidence requirements documented",
      "severity": "blocking",
      "verification_status": "source_documented",
      "provenance": {
        "source_type": "pattern_extraction_core",
        "archive_id": "arc-bots-knowledge-rar",
        "source_id": "gates-specialist_subworkflow",
        "program_phase": "KB-WPL-01.3B"
      }
    },
    {
      "gate_id": "specialist_subworkflow-tenant_boundary_valid",
      "title": "Tenant scope preserved",
      "description": "Tenant scope preserved",
      "severity": "blocking",
      "verification_status": "source_documented",
      "provenance": {
        "source_type": "pattern_extraction_core",
        "archive_id": "arc-bots-knowledge-rar",
        "source_id": "gates-specialist_subworkflow",
        "program_phase": "KB-WPL-01.3B"
      }
    },
    {
      "gate_id": "specialist_subworkflow-idempotency_valid",
      "title": "Idempotency policy matches retry behavior",
      "description": "Idempotency policy matches retry behavior",
      "severity": "blocking",
      "verification_status": "source_documented",
      "provenance": {
        "source_type": "pattern_extraction_core",
        "archive_id": "arc-bots-knowledge-rar",
        "source_id": "gates-specialist_subworkflow",
        "program_phase": "KB-WPL-01.3B"
      }
    },
    {
      "gate_id": "specialist_subworkflow-error_path_present",
      "title": "Terminal error path documented",
      "description": "Terminal error path documented",
      "severity": "blocking",
      "verification_status": "source_documented",
      "provenance": {
        "source_type": "pattern_extraction_core",
        "archive_id": "arc-bots-knowledge-rar",
        "source_id": "gates-specialist_subworkflow",
        "program_phase": "KB-WPL-01.3B"
      }
    },
    {
      "gate_id": "specialist_subworkflow-limitations_documented",
      "title": "Known limitations listed",
      "description": "Known limitations listed",
      "severity": "blocking",
      "verification_status": "source_documented",
      "provenance": {
        "source_type": "pattern_extraction_core",
        "archive_id": "arc-bots-knowledge-rar",
        "source_id": "gates-specialist_subworkflow",
        "program_phase": "KB-WPL-01.3B"
      }
    },
    {
      "gate_id": "specialist_subworkflow-manual_review_complete",
      "title": "Manual core audit complete",
      "description": "Manual core audit complete",
      "severity": "blocking",
      "verification_status": "source_documented",
      "provenance": {
        "source_type": "pattern_extraction_core",
        "archive_id": "arc-bots-knowledge-rar",
        "source_id": "gates-specialist_subworkflow",
        "program_phase": "KB-WPL-01.3B"
      }
    }
  ],
  "maturity": "reviewed",
  "provenance": {
    "source_type": "pattern_extraction_core",
    "archive_id": "arc-bots-knowledge-rar",
    "source_id": "specialist_subworkflow",
    "program_phase": "KB-WPL-01.3B"
  }
}
